f7a76000a2b13e7ace5f866f24a610ed83f61773514f0f5b2c8b0e5936cbfcbb	_PROTEIN_ inhibition shows promise in _DISEASE_.	PMID:31127250	ADAM10	PR:000001278	[[0..6]]	HD	MONDO:0007739	[[35..37]]	null	38	Y	ADAM10 inhibition shows promise in HD.	ADAM10 inhibition shows promise in HD.
032e4ef59fdb9f531f8e5c6ecd7a04459ebbed453e1754d2cd3feef65ef5c3ba	_PROTEIN_ plays dual roles in human _DISEASE_.	PMID:31271226	Wnt7a	PR:000017448	[[0..5]]	tumors	MONDO:0005070	[[32..38]]	null	39	Y	Wnt7a plays dual roles in human tumors.	Roles of Wnt7a in embryo development, tissue homeostasis, and human diseases.||||||||Human Wnt family comprises 19 proteins which are critical to embryo development and tissue homeostasis. Binding to different frizzled (FZD) receptor, Wnt7a initiates both β-catenin dependent pathway, and β-catenin independent pathways such as PI3K/Akt, RAC/JNK, and extracellular signal-regulated kinase 5/peroxisome proliferator-activated receptor-γ. In the embryo, Wnt7a plays a crucial role in cerebral cortex development, synapse formation, and central nervous system vasculature formation and maintenance. Wnt7a is also involved in the development of limb and female reproductive system. Wnt7a mutation leads to human limb malformations and animal female reproductive system defects. Wnt7a is implicated in homeostasis maintenance of skeletal muscle, cartilage, cornea and hair follicle, and Wnt7a treatment may be potentially applied in skeletal muscle dystrophy, corneal damage, wound repair, and hair follicle regeneration. Wnt7a plays dual roles in human tumors. Wnt7a is downregulated in lung cancers, functioning as a tumor suppressor, however, it is upregulated in several other malignancies such as ovarian cancer, breast cancer, and glioma, acting as a tumor promoter. Moreover, Wnt7a overexpression is associated with inflammation and fibrosis, but its roles need to be further investigated.
053ed30997b9b4a8c7d7978101161b831aee6f741edf35d91fec48efdc148bc2	[A _PROTEIN_-rearranged _DISEASE_].	PMID:31253456	NTRK1	PR:000011469	[[3..8]]	mammary carcinoma	MONDO:0004989	[[20..37]]	null	39	Y	[A NTRK1-rearranged mammary carcinoma].	[A NTRK1-rearranged mammary carcinoma].
0bd42a934f74126ae4afc8b3de99887a2e95b319d61a2eaa1f08d8fb93da3b73	_PROTEIN_ in macrophages promotes _DISEASE_.	PMID:31053833	FRA1	PR:Q8GS71	[[0..4]]	arthritis	MONDO:0005578	[[29..38]]	null	39	Y	FRA1 in macrophages promotes arthritis.	FRA1 in macrophages promotes arthritis.
9cfa9aeed60d982fdcec7d1024c41f3d2af065efb8aa3d1d1443fe58074dc727	_PROTEIN_ and Its Roles in Various _DISEASE_.	PMID:31311441	PRDX4	PR:000013194	[[0..5]]	Cancers	MONDO:0004992	[[31..38]]	null	39	Y	PRDX4 and Its Roles in Various Cancers.	PRDX4 and Its Roles in Various Cancers.||||||||Reactive oxygen species play a vital role in cell survival by regulating physiological metabolism and signal transduction of cells. The imbalance of oxidant and antioxidant states induces oxidative stress within a cell. Redox regulation and oxidative stress are closely related to survival and proliferation of stem cells, cancer cells, and cancer stem cells. Peroxiredoxin 4, a typical endoplasmic reticulum-resident 2-Cys antioxidant of peroxiredoxins, can fine-tune hydrogen peroxide catabolism which affects cell survival by affecting redox balance, oxidative protein folding, and regulation of hydrogen peroxide signaling. Recent studies revealed the overexpression of peroxiredoxin 4 in several kinds of cancers, such as breast cancer, prostate cancer, ovarian cancer, colorectal cancer, and lung cancer. And it has been demonstrated that peroxiredoxin 4 causally contributes to tumorigenesis, therapeutic resistance, metastasis, and recurrence of tumors. In this article, the characteristics of peroxiredoxin 4 in physiological functions and the cancer-related research progress of mammalian peroxiredoxin 4 is reviewed. We believe that peroxiredoxin 4 has the potential of serving as a novel target for multiple cancers.
f2790e671a5d13e31caf0b45eead8f96bdabcbbe6a914608dfaca41203f73a5e	Divergent roles of _PROTEIN_ in _DISEASE_.	PMID:31152824	Plexin D1	PR:000012899	[[19..28]]	cancer	MONDO:0004992	[[32..38]]	null	39	Y	Divergent roles of Plexin D1 in cancer.	Divergent roles of Plexin D1 in cancer.||||||||Plexin D1 belongs to a family of transmembrane proteins called plexins. It was characterized as a receptor for semaphorins and is known to be essential for axonal guidance and vascular patterning. Mutations in Plexin D1 have been implicated in pathologic conditions such as truncus arteriosus and Möbius syndrome. Emerging data show that expression of Plexin D1 is deregulated in several cancers; it can support tumor development by aiding in tumor metastasis and EMT; and conversely, it can act as a dependence receptor and stimulate cell death in the absence of its canonical ligand, semaphorin 3E. The role of Plexin D1 in tumor development and progression is thereby garnering research interest for its potential as a biomarker and as a therapeutic target. In this review, we describe its discovery, structure, mutations, role(s) in cancer, and therapeutic potential.
1107e7a19d7367f89e8bff2785be0965f7683a9d5ffed88de102b4673cfb4125	_PROTEIN_ is protumorigenic in _DISEASE_.	PMID:31541193	GLS2	PR:P38138	[[0..4]]	breast cancers	MONDO:0007254	[[26..40]]	null	41	Y	GLS2 is protumorigenic in breast cancers.	GLS2 is protumorigenic in breast cancers.||||||||Many types of cancers have a well-established dependence on glutamine metabolism to support survival and growth, a process linked to glutaminase 1 (GLS) isoforms. Conversely, GLS2 variants often have tumor-suppressing activity. Triple-negative (TN) breast cancer (testing negative for estrogen, progesterone, and Her2 receptors) has elevated GLS protein levels and reportedly depends on exogenous glutamine and GLS activity for survival. Despite having high GLS levels, we verified that several breast cancer cells (including TN cells) express endogenous GLS2, defying its role as a bona fide tumor suppressor. Moreover, ectopic GLS2 expression rescued cell proliferation, TCA anaplerosis, redox balance, and mitochondrial function after GLS inhibition by the small molecule currently in clinical trials CB-839 or GLS knockdown of GLS-dependent cell lines. In several cell lines, GLS2 knockdown decreased cell proliferation and glutamine-linked metabolic phenotypes. Strikingly, long-term treatment of TN cells with another GLS-exclusive inhibitor bis-2'-(5-phenylacetamide-1,3,4-thiadiazol-2-yl)ethyl sulfide (BPTES) selected for a drug-resistant population with increased endogenous GLS2 and restored proliferative capacity. GLS2 was linked to enhanced in vitro cell migration and invasion, mesenchymal markers (through the ERK-ZEB1-vimentin axis under certain conditions) and in vivo lung metastasis. Of concern, GLS2 amplification or overexpression is linked to an overall, disease-free and distant metastasis-free worse survival prognosis in breast cancer. Altogether, these data establish an unforeseen role of GLS2 in sustaining tumor proliferation and underlying metastasis in breast cancer and provide an initial framework for exploring GLS2 as a novel therapeutic target.
399313b212292a488f813cc3f2db24c73a05e4fef75e7d88d8bc87ddb105acb3	_PROTEIN_ mutations cause _DISEASE_ (DD).	PMID:31729179	LAMP2	PR:000002061	[[0..5]]	Danon disease	MONDO:0010281	[[22..35]]	null	41	Y	LAMP2 mutations cause Danon disease (DD).	Alu-mediated Xq24 deletion encompassing CUL4B, LAMP2, ATP1B4, TMEM255A, and ZBTB33 genes causes Danon disease in a female patient.||||||||Cullin 4B (CUL4B), lysosomal-associated membrane protein Type 2 (LAMP2), ATP1B4, TMEM255A, and ZBTB33 are neighboring genes on Xq24. Mutations in CUL4B result in Cabezas syndrome (CS). Male CS patients present with dysmorphic, neuropsychiatric, genitourinary, and endocrine abnormalities. Heterozygous CS females are clinically asymptomatic. LAMP2 mutations cause Danon disease (DD). Cardiomyopathy is a dominant feature of DD present in both males and heterozygous females. No monogenic phenotypes have been associated with mutations in ATP1B4, TMEM255A, and ZBTB33 genes. To facilitate diagnostics and counseling in CS and DD families, we present a female DD patient with a de novo Alu-mediated Xq24 rearrangement causing a deletion encompassing CUL4B, LAMP2, and also the other three neighboring genes. Typical to females heterozygous for CUL4B mutations, the patient was CS asymptomatic, however, presented with extremely skewed X-chromosome inactivation (XCI) ratios in peripheral white blood cells. As a result of the likely selection against CUL4B deficient clones, only minimal populations (~3%) of LAMP2 deficient leukocytes were identified by flow cytometry. On the contrary, myocardial LAMP2 protein expression suggested random XCI. We demonstrate that contiguous CUL4B and LAMP2 loss-of-function copy number variations occur and speculate that male patients carrying similar defects could present with features of both CS and DD.
1ca35a5e058f32bb2eba059dded6fd718587e90d937b47d828cb435b9f121a5d	_PROTEIN_ was upregulated in the _DISEASE_.	PMID:31501018	RBBP4	PR:000013776	[[0..5]]	colon cancer	MONDO:0021063	[[29..41]]	null	42	Y	RBBP4 was upregulated in the colon cancer.	Retinoblastoma binding protein 4 up-regulation is correlated with hepatic metastasis and poor prognosis in colon cancer patients.||||||||Retinoblastoma binding protein 4 (RBBP4) plays an essential role in the development of multiple cancers. However, its relationship with prognosis in colon cancer and colon cancer hepatic metastasis has not been elucidated. The aim of this study was to explore the relationship between RBBP4 expression and prognosis of colon cancer patients and to evaluate RBBP4 as a new prognostic marker in these patients.||||Eighty colon cancer patients underwent surgical resection of the colon were enrolled. Among them, forty colon cancer patients suffered with hepatic metastasis. The colon cancer tissues, para-colon cancer tissues, and hepatic metastatic cancer tissues were collected from the pathological department for further analysis. The expression of RBBP4 proteins was examined by immunohistochemistry and correlated with clinicopathological parameters. The Cancer Genome Atlas (TCGA) database was used to validate the expression and explore its relationship with clinical characteristics.||||RBBP4 was up-regulated in the colon cancer tissues compared with the para-colon cancer tissues. The analysis of TCGA database verified the upregulation of RBBP4 in the colon cancer tissues and RBBP4 overexpression was correlated with nerve invasion and poor outcomes of chemotherapy. Moreover, the positive rate of RBBP4 expression in 40 colon cancer patients with hepatic metastasis was higher in the hepatic metastatic cancer tissues (39/40, 97.5%) than in the colon cancer tissues (26/40, 65.0%). Our clinicopathological analysis showed that RBBP4 expression was significantly correlated with vascular invasion, hepatic metastasis, and lymph node involvement (all P < 0.05). Additionally, the survival analysis demonstrated that RBBP4 over-expression was correlated with poor prognosis.||||RBBP4 was upregulated in the colon cancer. RBBP4 may be a novel predictor for poor prognosis of colon cancer and colon cancer hepatic metastasis.
22a5bc6de80e95416cffa2d28a0c13769e30c704d5d0f1d34b1e834e8a52d91c	_PROTEIN_ Orchestrates _DISEASE_ Metastasis.	PMID:31626776	BACH1	PR:000004816	[[0..5]]	Lung Cancer	MONDO:0008903	[[19..30]]	null	42	Y	BACH1 Orchestrates Lung Cancer Metastasis.	BACH1 Orchestrates Lung Cancer Metastasis.
dd0c52f5c10a530878ae8fcf70c2a859db3da3e82cfe88a1b98cc1775f02ad5d	The effect of LncRNA _PROTEIN_5 on _DISEASE_ cells.	PMID:31172354	GAS	PR:000007856	[[21..24]]	glioma	MONDO:0021042	[[29..35]]	null	42	Y	The effect of LncRNA GAS5 on glioma cells.	LncRNA GAS5 regulates the proliferation, migration, invasion and apoptosis of brain glioma cells through targeting GSTM3 expression. The effect of LncRNA GAS5 on glioma cells.||||||||To investigate the effects of lncRNA GAS5 on the proliferation, migration, invasion and apoptosis of brain glioma cells.||||The expression levels of lncRNA GAS5 and GSTM3 in normal glial cells (HEB) and glioma cells (U251 and U87) were detected by RT-qPCR and western blot, respectively. Glioma cells were transfected with ctrl vector, pcDNA-GAS5, siRNA ctrl (siNC) or GSTM3 siRNA and the effects of lncRNA GAS5 and GSTM3 on the proliferation, migration, invasion and apoptosis of glioma cells were detected by CCK-8 assay, transwell assay and Caspase 3/7 activity assay, respectively.||||The expression of lncRNA GAS5 was significantly decreased in glioma cell lines U251 and U87 compared with normal glial cells HEB (p < 0.01). In addition, overexpression of lncRNA GAS5 inhibited the proliferation, migration and invasion of U251 and U87 cells, and promoted cell apoptosis as demonstrated by the increased activity of Caspase 3/7. Furthermore, GSTM3 was predicted as a target gene of lncRNA GAS5 by bioinformatics analysis and its expression was increased in glioma cells compared with the normal cells as indicated by western blotting and RT-qPCR experimental results. Silencing of GSTM3 with GSTM3 siRNA decreased the proliferation, migration and invasion but increased the apoptosis of glioma cell lines U251 and U87, which was similar to that the effect lncRNA GAS5 over-expression.||||lncRNA GAS5 can effectively inhibit the proliferation, migration and invasion of glioma cells and promote cell apoptosis through targeting GSTM3 expression.
e9ff2fd72a00dac7a2dafe857b6bcc90528845c515df002a2d6eefd36685e5f0	_PROTEIN_ serves as a _DISEASE_ suppressor in HCC.	PMID:31666108	GSTZ1	PR:000008307	[[0..5]]	tumor	MONDO:0005070	[[18..23]]	null	42	Y	GSTZ1 serves as a tumor suppressor in HCC.	GSTZ1 deficiency promotes hepatocellular carcinoma proliferation via activation of the KEAP1/NRF2 pathway.||||||||Glutathione S-transferase zeta 1 (GSTZ1) is the penultimate enzyme in phenylalanine/tyrosine catabolism. GSTZ1 is dysregulated in cancers; however, its role in tumorigenesis and progression of hepatocellular carcinoma (HCC) is largely unknown. We aimed to assess the role of GSTZ1 in HCC and to reveal the underlying mechanisms, which may contribute to finding a potential therapeutic strategy against HCC.||||) induced hepatocarcinogenesis in a mouse model of HCC.|||| mice.||||GSTZ1 serves as a tumor suppressor in HCC. GSH depletion caused by GSTZ1 deficiency elevates oxidative stress, thus constitutively activating the NRF2 antioxidant response pathway and accelerating HCC progression. Targeting the NRF2 signaling pathway may be a promising therapeutic approach for this subset of HCC.
08397ecebfc9f3c2628ce026612b18ada407ca2d067a756b5a71618dffbe01d9	The _DISEASE_ usually requires _PROTEIN_.	PMID:31588541	insulin	PR:000009054	[[35..42]]	hyperglycemia	MONDO:0002909	[[4..17]]	null	43	Y	The hyperglycemia usually requires insulin.	Monogenic Forms of Diabetes Mellitus.||||||||In addition to the common types of diabetes mellitus, two major monogenic diabetes forms exist. Maturity-onset diabetes of the young (MODY) represents a heterogenous group of monogenic, autosomal dominant diseases. MODY accounts for 1-2% of all diabetes cases, and it is not just underdiagnosed but often misdiagnosed to type 1 or type 2 diabetes. More than a dozen MODY genes have been identified to date, and their molecular classification is of great importance in the correct treatment decision and in the judgment of the prognosis. The most prevalent subtypes are HNF1A, GCK, and HNF4A. Genetic testing for MODY has changed recently due to the technological advancements, as contrary to the sequential testing performed in the past, nowadays all MODY genes can be tested simultaneously by next-generation sequencing. The other major group of monogenic diabetes is neonatal diabetes mellitus which can be transient or permanent, and often the diabetes is a part of a syndrome. It is a severe monogenic disease appearing in the first 6 months of life. The hyperglycemia usually requires insulin. There are two forms, permanent neonatal diabetes mellitus (PNDM) and transient neonatal diabetes mellitus (TNDM). In TNDM, the diabetes usually reverts within several months but might relapse later in life. The incidence of NDM is 1:100,000-1:400,000 live births, and PNDM accounts for half of the cases. Most commonly, neonatal diabetes is caused by mutations in KCNJ11 and ABCC8 genes encoding the ATP-dependent potassium channel of the β cell. Neonatal diabetes has experienced a quick and successful transition into the clinical practice since the discovery of the molecular background. In case of both genetic diabetes groups, recent guidelines recommend genetic testing.
25e9dd4470b169f3fb7722260666a92a60ac562c89203e21d3ccb016a1ec8f85	_DISEASE_ often expresses _PROTEIN_.	PMID:31021421	MUC6	PR:000010770	[[38..42]]	Endometrial carcinoma	MONDO:0002447	[[0..21]]	null	43	Y	Endometrial carcinoma often expresses MUC6.	Immunohistochemical expression of HIK1083 and MUC6 in endometrial carcinomas.||||||||Gastric-type endocervical adenocarcinoma (EA) is characterised by aggressive behaviour and pathogenesis independent of human papillomavirus infection. Because of its morphology and frequent mutation-pattern expression of p53, gastric-type EA may be confused with several types of endometrial carcinoma, particularly in biopsy and curettage specimens. HIK1083 and MUC6 are immunohistochemical markers used to support a diagnosis of gastric-type EA; however, the rates of expression of these markers in endometrial tumours are largely unknown. We therefore aimed to assess the expression of HIK1083 and MUC6 in a cohort of different types of endometrial carcinoma.||||Ninety-one endometrial carcinomas (56 endometrioid, 16 clear cell, and 19 serous) from 91 patients treated with hysterectomy were included. A representative tumour block from each case was used for immunohistochemical staining with HIK1083 and MUC6. The percentage of stained cells (0-100%) and average staining intensity (weak, moderate, and strong) were recorded for both markers. None of 91 cases expressed HIK1083. In contrast, 66% (60/91) of cases showed at least focal expression of MUC6; importantly, 54 of 60 (90%) positive cases showed moderate or strong staining. Five of 60 (8%) cases showed MUC6 staining in ≥50% of tumour cells. Endometrioid tumours (49/56, 88%) were more likely to express MUC6 than cases of clear cell (1/16, 6%) or serous (10/19, 53%) carcinoma.||||Endometrial carcinoma often expresses MUC6. In contrast, HIK1083 is consistently negative, and thus, when positive, is a more reliable marker for distinguishing gastric-type EA from some of its endometrial mimics.
6e7603b0b969d5f72752527bc4a8ab79ae3475ab6ca482e00ca89d47b499c3bc	_PROTEIN_ variant causes _DISEASE_.	PMID:31186544	DEGS1	PR:000006413	[[0..5]]	neurological disorder	MONDO:0005071	[[21..42]]	null	43	Y	DEGS1 variant causes neurological disorder.	DEGS1 variant causes neurological disorder.||||||||Sphingolipidoses are monogenic lipid storage diseases caused by variants in enzymes of lipid synthesis and metabolism. We describe an autosomal recessive complex neurological disorder affecting consanguineous kindred. All four affected individuals, born at term following normal pregnancies, had mild to severe intellectual disability, spastic quadriplegia, scoliosis and epilepsy in most, with no dysmorphic features. Brain MRI findings were suggestive of leukodystrophy, with abnormal hyperintense signal in the periventricular perioccipital region and thinning of the body of corpus callosum. Notably, all affected individuals were asymptomatic at early infancy and developed normally until the age of 8-18 months, when deterioration ensued. Homozygosity mapping identified a single 8.7 Mb disease-associated locus on chromosome 1q41-1q42.13 between rs1511695 and rs537250 (two-point LOD score 2.1). Whole exome sequencing, validated through Sanger sequencing, identified within this locus a single disease-associated homozygous variant in DEGS1, encoding C4-dihydroceramide desaturase, an enzyme of the ceramide synthesis pathway. The missense variant, segregating within the family as expected for recessive heredity, affects an evolutionary-conserved amino acid of all isoforms of DEGS1 (c.656A>G, c.764A>G; p.(N219S), p.(N255S)) and was not found in a homozygous state in ExAC and gnomAD databases or in 300 ethnically matched individuals. Lipidomcs analysis of whole blood of affected individuals demonstrated augmented levels of dihydroceramides, dihydrosphingosine, dihydrosphingosine-1-phosphate and dihydrosphingomyelins with reduced levels of ceramide, sphingosine, sphingosine-1-phosphate and monohexosylceramides, as expected in malfunction of C4-dihydroceramide desaturase. Thus, we describe a sphingolipidosis causing a severe regressive neurological disease.
dc280aaf1c4d78347c7063b7374732d3aebf1e55a04b3e8575f86aea8a8392d9	_PROTEIN_ was highly expressed in _DISEASE_ cells.	PMID:31613821	RDH10	PR:000013848	[[0..5]]	glioma	MONDO:0021042	[[30..36]]	null	43	Y	RDH10 was highly expressed in glioma cells.	Retinol dehydrogenase 10 promotes metastasis of glioma cells via the transforming growth factor-β/SMAD signaling pathway.||||||||Glioma is the most common primary malignant tumor in the central nervous system. Because of the resistance of glioma to chemoradiotherapy and its aggressive growth, the survival rate of patients with glioma has not improved. This study aimed to disclose the effect of retinol dehydrogenase 10 (RDH10) on the migration and invasion of glioma cells, and to explore the potential mechanism.||||Reverse transcription-polymerase chain reaction (RT-PCR) was used to determine the expression levels of RDH10 in healthy glial cells and glioma cells. Human glioma cell strains, U87 and U251, were infected with negative control or RDH10-interfering lentiviruses. RT-PCR and Western blotting were performed to determine the knockdown efficiency. Scratch and transwell assays were used to assess cell migration and invasion after RDH10 knockdown. Finally, changes in transforming growth factor-β (TGF-β)/SMAD signaling pathway-related expression were examined by Western blotting. Differences between groups were analyzed by one-way analysis of variance.||||RDH10 was highly expressed in glioma cells. Compared with the control group, RDH10 knockdown significantly reduced RDH10 messenger RNA and protein expression levels in U87 and U251 glioma cells (U87: 1.00 ± 0.08 vs. 0.22 ± 0.02, t = 16.55, P < 0.001; U251: 1.00 ± 0.17 vs. 0.39 ± 0.01, t = 6.30, P < 0.001). The scratch assay indicated that compared with the control group, RDH10 knockdown significantly inhibited the migration of glioma cells (U87: 1.00% ± 0.04% vs. 2.00% ± 0.25%, t = 6.08, P < 0.01; U251: 1.00% ± 0.11% vs. 2.48% ± 0.31%, t = 5.79, P < 0.01). Furthermore, RDH10 knockdown significantly inhibited the invasive capacity of glioma cells (U87: 97.30 ± 7.01 vs. 13.70 ± 0.58, t = 20.36, P < 0.001; U251: 96.20 ± 7.10 vs. 18.30 ± 2.08, t = 18.51, P < 0.001). Finally, Western blotting demonstrated that compared with the control group, downregulation of RDH10 significantly inhibited TGF-β expression, phosphorylated SMAD2, and phosphorylated SMAD3 (TGF-β: 1.00 ± 0.10 vs. 0.53 ± 0.06, t = 7.05, P < 0.01; phosphorylated SMAD2: 1.00 ± 0.20 vs. 0.42 ± 0.17, t = 4.01, P < 0.01; phosphorylated SMAD3: 1.00 ± 0.18 vs. 0.41 ± 0.12, t = 4.12, P < 0.01).||||RDH10 knockdown might inhibit metastasis of glioma cells via the TGF-β/SMAD signaling pathway.
e7325c7329edbcc9102c0c9f649c1b7c75b12bb1bb634e112a385edd728a6bf0	Context-specific _DISEASE_ suppression by _PROTEIN_.	PMID:31000514	PHF6	PR:000012653	[[38..42]]	tumor	MONDO:0005070	[[17..22]]	null	43	Y	Context-specific tumor suppression by PHF6.	Context-specific tumor suppression by PHF6.
088e520b4e0e494f139cae2ece0fce4b4ec0b85d2ab83e623b8b10a34f5cc9d9	_PROTEIN_ may serve as a new biomarker for _DISEASE_.	PMID:31469350	ADAM17	PR:000001279	[[0..6]]	ILD	MONDO:0015925	[[40..43]]	null	44	Y	ADAM17 may serve as a new biomarker for ILD.	Association of ADAM17 Expression Levels in Patients with Interstitial Lung Disease.||||||||CO) and total lung capacity (TLC). Among the CTD-ILD patients, SSc-ILD patients had the highest serum levels of ADAM17 compared with the RA-ILD, SS-ILD and IIM-ILD groups and ADAM17 expression levels were correlated with image grading. In conclusion, this study showed that ADAM17 is highly expressed in ILD patients and is associated with disease activity and severity. Additionally, ADAM17 expression is not only related to the primary CTDs, but also to image grading. ADAM17 may serve as a new biomarker for ILD.
