fc00389da4509efe121d0dd5576ea8864264852d88d320aab20e0ae710fc94ac	_PROTEIN_ missense variants in human _DISEASE_.	PMID:31187595	TET2	PR:000016245	[[0..4]]	neoplasia	MONDO:0005070	[[32..41]]	null	42	Y	TET2 missense variants in human neoplasia.	TET2 missense variants in human neoplasia. A proposal of structural and functional classification.||||||||The human TET2 gene plays a pivotal role in the epigenetic regulation of normal and malignant hematopoiesis. Somatic TET2 mutations have been repeatedly identified in age-related clonal hematopoiesis and in myeloid neoplasms ranging from acute myeloid leukemia (AML) to myeloproliferative neoplasms. However, there have been no attempts to systematically explore the structural and functional consequences of the hundreds of TET2 missense variants reported to date.||||We have sequenced the TET2 gene in 189 Spanish AML patients using Sanger sequencing and NGS protocols. Next, we performed a thorough bioinformatics analysis of TET2 protein and of the expected impact of all reported TET2 missense variants on protein structure and function, exploiting available structure-and-function information as well as 3D structure prediction tools.||||We have identified 38 TET2 allelic variants in the studied patients, including two frequent SNPs: p.G355D (10 cases) and p.I1762V (28 cases). Four of the detected mutations are reported here for the first time: c.122C>T (p.P41L), c.4535C>G (p.A1512G), c.4760A>G (p.D1587G), and c.5087A>T (p.Y1696F). We predict a complex multidomain architecture for the noncatalytic regions of TET2, and in particular the presence of well-conserved α+β globular domains immediately preceding and following the actual catalytic unit. Further, we provide a rigorous interpretation of over 430 missense SNVs that affect the TET2 catalytic domain, and we hypothesize explanations for ~700 additional variants found within the regulatory regions of the protein. Finally, we propose a systematic classification of all missense mutants and SNPs reported to date into three major categories (severe, moderate, and mild), based on their predicted structural and functional impact.||||The proposed classification of missense TET2 variants would help to assess their clinical impact on human neoplasia and may guide future structure-and-function investigations of TET family members.
ee2c3adb152f3c851270a061ac02809800e6ba739c41df3c5cfd8e7fafd4edf2	Friend or foe, the role of _PROTEIN_ in _DISEASE_.	PMID:31748910	EGR-1	PR:000006937	[[27..32]]	cancer	MONDO:0004992	[[36..42]]	null	43	Y	Friend or foe, the role of EGR-1 in cancer.	Friend or foe, the role of EGR-1 in cancer.||||||||Early growth response-1 (EGR-1), also termed NEFI-A and Krox-24, as a multi-domain protein is implicated in several vital physiological processes, including development, metabolism, cell growth and proliferation. Previous studies have implied that EGR-1 was producing in response to the tissue injury, immune response and fibrosis. Meanwhile, emerging studies stressed the pronounced correlation of EGR-1 and human cancers. Nevertheless, the intricate mechanisms of cancer-reduce EGR-1 alteration still poorly characterized. In the review, we evaluated the effects of EGR-1 in tumor cell proliferation, apoptosis, migration, invasion and tumor microenvironment, and then, we dwell on the intricate signaling pathways that EGR-1 involved in. The aberrantly expressed of EGR-1 in cancers are expected to provide a new cancer therapy strategy or a new marker for assessing treatment efficacy.
b40b34d1e17c9eac6c30fc3b56275dea0866a3458c3b5562e29fd4ce498ecc0d	_PROTEIN_: An Upstream Kinase of STATs in _DISEASE_.	PMID:31694222	TYK2	PR:000016874	[[0..4]]	Cancer	MONDO:0004992	[[37..43]]	null	44	Y	TYK2: An Upstream Kinase of STATs in Cancer.	TYK2: An Upstream Kinase of STATs in Cancer.||||||||-mutated alleles established the central role in immunological and inflammatory responses. For the description of physiological TYK2 structure/function relationships in cytokine signaling and of overarching molecular and pathologic properties in carcinogenesis, we mainly refer to the most recent reviews. Dysregulated TYK2 activation, aberrant TYK2 protein levels, and gain-of-function (GOF) TYK2 mutations are found in various cancers. We discuss the molecular consequences thereof and briefly describe the molecular means to counteract TYK2 activity under (patho-)physiological conditions by cellular effectors and by pharmacological intervention. For the role of TYK2 in tumor immune-surveillance we refer to the recent Special Issue of Cancers "JAK-STAT Signaling Pathway in Cancer".
097d1d14d597bfc65f1a8925e117de175eef723ac78f0aa81fc0c68a803fcde4	The role of _PROTEIN_ in _DISEASE_ remains unclear.	PMID:31619201	FGFR3	PR:000001450	[[12..17]]	melanoma	MONDO:0005105	[[21..29]]	null	46	Y	The role of FGFR3 in melanoma remains unclear.	FGFR3 promotes the growth and malignancy of melanoma by influencing EMT and the phosphorylation of ERK, AKT, and EGFR.||||||||Overexpression of fibroblast growth factor receptor 3 (FGFR3) has been linked to tumor progression in many types of cancer. The role of FGFR3 in melanoma remains unclear. In this study, we aimed to uncover the role of FGFR3 in the growth and metastasis of melanoma.||||FGFR3 knockdown and overexpression strategies were employed to investigate the effects of FGFR3 on colony formation, cell apoptosis, proliferation, migration, and in vitro invasion, along with the growth and metastasis of melanoma in a xenografts mouse model. The protein expression levels of extracellular signal-regulated kinase (ERK), protein kinase B (AKT), epidermal growth factor receptor (EGFR), and epithelial-mesenchymal transition (EMT) markers were determined by Western blot analysis.||||The mRNA expression of FGFR3 was higher in melanoma tissues than normal healthy tissues. FGFR3 expression in cutaneous malignant melanoma (CMM) tissues was positively correlated with the Breslow thickness and lymph node metastasis. In A357 cells, knockdown of the FGFR3 gene decreased the colony formation ability, cell proliferation, invasion, and migration, but increased the caspase 3 activity and the apoptosis rate; overexpression of FGFR3 increased the colony formation ability, cell proliferation, invasion, and migration, but decreased the caspase 3 activity and apoptosis rates. FGFR3 knockdown also upregulated E-cadherin, downregulated N-cadherin and vimentin, and decreased the phosphorylation levels of ERK, AKT, and EGFR. In the MCC xenografts mice, knockdown of FGFR3 decreased tumor growth and metastasis.||||FGFR3, which is highly expressed in CMM tissues, is correlated with increased Breslow thickness and lymph node metastasis. FGFR3 promotes melanoma growth, metastasis, and EMT behaviors, likely by affecting the phosphorylation levels of ERK, AKT, and EGFR.
23b2093af99f36ee180b5c5ddf02c15ed7742fef94879a32bd765f29748310ff	_PROTEIN_ levels are much variable in _DISEASE_ patients.	PMID:31410730	IL-6	PR:000001393	[[0..4]]	RCC	MONDO:0005086	[[33..36]]	null	46	Y	IL-6 levels are much variable in RCC patients.	Prognostic role of interleukin-6 in renal cell carcinoma: a meta-analysis.||||||||To evaluate the prognostic role of interleukin-6 (IL-6) in renal cell carcinoma (RCC).||||Relevant research articles were obtained from literature databases. Data were extracted from study reports which reported IL-6 levels in relevance to RCC prognosis and random-effects meta-analyses were performed to estimate IL-6 levels, percentage of patients with high IL-6 levels, and hazard/odds ratios between high and low IL-6 levels in survival outcomes.||||22 studies (1976 patients; age 59.9 years [95% confidence interval (CI) 58.0, 61.8]; 33% [95% CI 29, 36] females) were included. IL-6 levels in RCC patients ranged from 8.9 ± 13-193 ± 101 picograms per milliliter (pg/ml) which were higher than those of normal healthy individuals (mean difference 13.96 pg/ml [95% CI: 1.52, 26.40]; p = 0.03). Percentage of RCC patients with high IL-6 levels was 48.98% [95% CI 42.94, 55.03] and this rate was greater in advanced (51.73% [95% CI 45.94, 57.53]) than in local (40.75% [95% CI 26.23, 55.27]) RCC. Survival was longer in patients with low compared to high IL-6 levels (MD 9.65 months [95% CI 5.01, 14.29]; p < 0.0006 and hazard ratio 3.03 [95% CI 2.37, 3.70]). Treatment response rate was significantly higher in patients with low IL-6 than high IL-6 levels (odds ratio 5.11 [95% CI 2.21, 11.77]; p < 0.00001). There was a strong correlation between IL-6 and c-reactive protein levels (correlation coefficient 0.622 [95% CI 0.431, 0.760]; p = 0.00001).||||IL-6 levels are much variable in RCC patients. High levels of IL-6 in RCC patients are associated with poor survival.
22369fc2856eef6b0edd79a69cb23058c25f74a33a4a27f28c07277c874de0d9	_PROTEIN_ _DISEASE_ risk alleles.	PMID:31563468	APOL1	PR:000004158	[[0..5]]	nephropathy	MONDO:0005240	[[6..17]]	null	31	Y	APOL1 nephropathy risk alleles.	APOL1 Nephropathy Risk Alleles and Mortality in African American Adults: A Cohort Study.||||||||APOL1 nephropathy risk alleles are associated with the development of chronic kidney disease (CKD) in African Americans. Although CKD is an established risk factor for mortality, associations of APOL1 risk alleles with mortality are uncertain.||||Prospective cohort.||||10,380 African American and 17,485 white American participants in the Reasons for Geographic and Racial Differences in Stroke (REGARDS) Study.||||APOL1 nephropathy risk alleles.||||All-cause and cause-specific mortality.||||Cox proportional hazards models were used to examine the association of APOL1 high-risk genotypes (2 risk alleles) versus APOL1 low-risk genotypes (0/1 risk allele) with all-cause and cause-specific mortality in African Americans and examine the risk for all-cause mortality in African Americans with high-risk genotypes versus African Americans with low-risk genotypes and white Americans.||||=0.04), with African Americans with high-risk genotypes having lower risk for mortality than those with low-risk genotypes in fully adjusted models (HR, 0.78; 95% CI, 0.62-0.99) among those with CKD, but not those without CKD (HR, 0.84; 95% CI, 0.66-1.05). Compared with white Americans, African Americans with high-risk genotypes had a similar rate of mortality, whereas African Americans with low-risk genotypes had a higher rate of mortality (HR, 1.07; 95% CI, 1.00-1.14) in fully adjusted models.||||Lack of follow-up measures of kidney function.||||African Americans with high-risk APOL1 genotypes had lower mortality than those with low-risk genotypes in multivariable-adjusted models including genetic ancestry.
4a3e180190169c51844216cadf39fb5305c9eb543cfc352528e59cbc6d29d73d	Inhibitors of _PROTEIN_ in _DISEASE_.	PMID:31659567	HSP90	PR:000022937	[[14..19]]	melanoma	MONDO:0005105	[[23..31]]	null	32	Y	Inhibitors of HSP90 in melanoma.	Inhibitors of HSP90 in melanoma.||||||||HSP90 (heat shock protein 90) is an ATP-dependent molecular chaperone involved in a proper folding and maturation of hundreds of proteins. HSP90 is abundantly expressed in cancer, including melanoma. HSP90 client proteins are the key oncoproteins of several signaling pathways controlling melanoma development, progression and response to therapy. A number of natural and synthetic compounds of different chemical structures and binding sites within HSP90 have been identified as selective HSP90 inhibitors. The majority of HSP90-targeting agents affect N-terminal ATPase activity of HSP90. In contrast to N-terminal inhibitors, agents interacting with the middle and C-terminal domains of HSP90 do not induce HSP70-dependent cytoprotective response. Several inhibitors of HSP90 were tested against melanoma in pre-clinical studies and clinical trials, providing evidence that these agents can be considered either as single or complementary therapeutic strategy. This review summarizes current knowledge on the role of HSP90 protein in cancer with focus on melanoma, and provides an overview of structurally different HSP90 inhibitors that are considered as potential therapeutics for melanoma treatment.
ef381d62997d6e5e505f2aff56ec771ba25b2d8c5863705f7fe0583c9ea8e52f	_PROTEIN_ mutations in _DISEASE_.	PMID:31318440	ESR1	PR:000029233	[[0..4]]	breast cancer	MONDO:0007254	[[18..31]]	null	32	Y	ESR1 mutations in breast cancer.	ESR1 mutations in breast cancer.||||||||The acquisition of ligand-independent ESR1 mutations during aromatase inhibitor therapy in metastatic estrogen receptor (ER)-positive breast cancer is a common mechanism of hormonal therapy resistance. Preclinical and clinical studies have demonstrated that ESR1 mutations can preexist in primary tumors and can be enriched during metastasis. Furthermore, ESR1 mutations express a unique transcriptional profile that favors tumor progression, suggesting that selected ESR1 mutations may influence metastasis. Several groups have used sensitive detection methods using patient liquid biopsies to track ESR1 or truncal somatic mutations to predict treatment outcome and tumor progression, and some of these techniques may eventually be used to guide sequential treatment options in patients. Further development and standardization of mutation tracking in circulating tumor DNA is ongoing. Clinically, patients with ESR1 mutations derive clinical benefit when treated with fulvestrant and CDK4/6-targeted therapies, but the development of more potent selective ER degraders and/or new targeted biotherapies are needed to overcome the endocrine-resistant phenotype of ESR1 mutant-bearing tumors. In this review, we discuss the mechanisms of resistance and dissemination of ESR1 mutations as well as the detection methods for ESR1 mutation tracking, newly discovered potential therapeutic targets, and the clinical implications and treatment options for treating patients with ESR1 mutant-bearing tumors.
3ae25fca6df9ec229d3475f632df7502a3582a2bb6c881aff5bc67b9f60a1d52	Update on _PROTEIN_-Related _DISEASE_.	PMID:31768667	KMT2B	PR:000010446	[[10..15]]	Dystonia	MONDO:0003441	[[24..32]]	null	33	Y	Update on KMT2B-Related Dystonia.	Update on KMT2B-Related Dystonia.||||||||To summarize the molecular and clinical findings of KMT2B-related dystonia (DYT-KMT2B), a newly identified genetic dystonia syndrome.||||Since first described in 2016, 66 different KMT2B-affecting variants, encompassing a set of frameshift, nonsense, splice-site, missense, and deletion mutations, have been reported in 76 patients. Most mutations are de novo and expected to mediate epigenetic dysregulation by inducing KMT2B haploinsufficiency. DYT-KMT2B is characterized phenotypically by limb-onset childhood dystonia that tends to spread progressively, resulting in generalized dystonia with cranio-cervical involvement. Co-occuring signs such as intellectual disability are frequently observed. Sustained response to deep brain stimulation (DBS), including restoration of independent ambulation, is seen in 93% (27/29) of patients. DYT-KMT2B is emerging as a prevalent monogenic dystonia. Childhood-onset dystonia presentations should prompt a search for KMT2B mutations, preferentially via next-generation-sequencing and genomic-array technologies, to enable specific counseling and treatment. Prospective multicenter studies are desirable to establish KMT2B mutational status as a DBS outcome predictor.
282a4c895448ebf7a8e260bf4eac6b5a8bef530380ae8893a7daf28e9a90ce11	_PROTEIN_ inhibition in _DISEASE_.	PMID:31666925	UCHL5	PR:000017026	[[0..5]]	ovarian cancer	MONDO:0008170	[[20..34]]	null	35	Y	UCHL5 inhibition in ovarian cancer.	UCHL5 inhibition in ovarian cancer.||||||||-mutant ovarian cancer cell survival by regulating TGF-β signaling through inhibiting UCHL5 expression and dephosphorylating Smad2, consequently inducing apoptosis. bAP15 (2.5 and 5.0 mg/kg) also exerted significant anti-tumor effect on nude mice bearing subcutaneous SKOV3 xenografts. As activated TGF-β signaling is involved in ovarian cancer progression, these findings suggest that UCHL5 inhibition offers potential opportunities for a novel targeted therapy against TGF-β-activated ovarian cancer.
7e3b8836067b1affa708370850ef3febb09332c9e3b90f6eb777f39d1c62b421	_PROTEIN_ improves survival in lethal _DISEASE_.	PMID:31764615	Pad2	PR:P46309	[[0..4]]	HS	MONDO:0019395	[[33..35]]	null	36	Y	Pad2 improves survival in lethal HS.	Peptidylarginine Deiminase 2 Knockout Improves Survival in Hemorrhagic Shock.||||||||The peptidylarginine deiminase (PAD) family converts arginine into citrulline through protein citrullination. PAD2 and PAD4 inhibitors can improve survival in hemorrhagic shock (HS). However, the impact of isoform specific PAD inhibition in improving survival has not been studied. In this study, we utilize selective Pad2 knockout (KO) mice to elucidate loss of function of PAD2 leads to pro-survival effect in HS.||||HS: Pad2 and wild type (WT) mice (n = 5/group) were subjected to lethal HS (55% volume hemorrhage). Survival was monitored over seven days. Myocardial infarction (MI): Pad2 and WT mice (n = 9/group) were subjected to MI by permanent LAD ligation to examine the effect of ischemia on the heart. After 24 hours cardiac function and infarct size were measured.||||HS: Pad2 mice demonstrated 100% survival compared to 0% for WT mice (p = 0.002). In a sub-lethal HS model, cardiac β-catenin levels were higher in Pad2 compared to WT after 24 hours. MI: WT mice demonstrated larger MI (75%) compared to Pad2 (60%) (p < 0.05). Pad2 had significantly higher ejection fraction and fractional shortening compared to WT (p < 0.05).||||Pad2 improves survival in lethal HS. Possible mechanisms by which loss of PAD2 function improve survival include the activation of cell survival pathways, improved tolerance of cardiac ischemia and improved cardiac function during ischemia. PAD2 is promising as a future therapeutic target for the treatment of HS and cardiac ischemia.
b82ad8e0d848895e2963b8c78f3ed73fa4129e0d814586bda0166b5f0fbe2bd3	_PROTEIN_ is a critical _DISEASE_ suppressor.	PMID:31695837	TP53	PR:000003035	[[0..4]]	tumor	MONDO:0005070	[[19..24]]	null	36	Y	TP53 is a critical tumor suppressor.	A negative feedback regulatory loop between miR-138 and TP53 is mediated by USP10.||||||||TP53 is a critical tumor suppressor. In approximately 50% of human cancers the TP53 gene is either lost or mutated. The expression level of TP53 in the cells is tightly controlled by a fine-tune machinery, mainly through the Mdm2-mediated ubiquitination pathway. On the other side, the ubiquitinated TP53 could be reversed and stabilized by USP7 and USP10, to keep the amount of TP53 in check. MicroRNAs can negatively regulate TP53 expression levels through direct targeting or positively regulate TP53 function through the repression of negative regulators of TP53. Here we report that microRNA-138 controls TP53 expression by directly targeting USP10. Furthermore, TP53 represses microRNA-138 expression, forming a negative feedback regulatory loop. This finding adds another layer of complexity to the TP53 network.
e526fa3bca1cb5b7cc6e0e706292a860ff4a10e1614b5aa086ed7e857c2696b4	_PROTEIN_ is highly expressed in _DISEASE_.	PMID:31575956	TRPM2	PR:000016698	[[0..5]]	cancer	MONDO:0004992	[[29..35]]	null	36	Y	TRPM2 is highly expressed in cancer.	The Human Transient Receptor Potential Melastatin 2 Ion Channel Modulates ROS Through Nrf2.||||||||Transient receptor potential melastatin channel subfamily member 2 (TRPM2) has an essential role in protecting cell viability through modulation of oxidative stress. TRPM2 is highly expressed in cancer. When TRPM2 is inhibited, mitochondria are dysfunctional, ROS levels are increased, and cell viability is reduced. Here, the importance of NF-E2-related factor (Nrf2) in TRPM2-mediated suppression of oxidant stress was explored. In TRPM2 depleted cells, antioxidant cofactors glutathione, NADPH, and NADH were significantly reduced. Cytoplasmic and nuclear expression of Nrf2 and of IQGAP1, a modulator of Nrf2 stability regulated by intracellular calcium, were decreased. Antioxidant enzymes transcriptionally regulated by Nrf2 and involved in GSH, NADPH, and NADH generation were significantly lower including PRX1 and PRX3, GPX4, GSTP1, GCLC, and MTHFD2. The glutamine pathway leading to GSH production was suppressed, and ATP and GTP levels were impaired. Reconstitution with wild type TRPM2 or Nrf2, but not TRPM2 pore mutant E960D, rescued expression of enzymes downstream of Nrf2 and restored GSH and GTP. Cell viability, ROS, NADPH, NADH, and ATP levels were fully rescued by TRPM2 and partially by Nrf2. These data show that TRPM2 maintains cell survival following oxidative stress through modulation of antioxidant pathways and cofactors regulated by Nrf2.
0dfa5687543c47d27029fc9d70754a7f421cafdac2ace151029115738f0be4ef	Inhibition of _PROTEIN_ in _DISEASE_ Cells.	PMID:31810919	PIN1	PR:000031258	[[14..18]]	Melanoma	MONDO:0005105	[[22..30]]	null	37	Y	Inhibition of PIN1 in Melanoma Cells.	Inhibition of PIN1 in Melanoma Cells.||||||||PLX4032 is commonly used in the treatment of advanced melanoma patients with BRAF-V600E mutation. The aim of this study was to elucidate the mechanisms by which up-regulation of PIN1 confers PLX4032 resistance in melanoma.||||The expression of PIN1 as well as the cytotoxic effects of combinatorial treatment of PLX4032 and all-trans retinoic acid (ATRA) were investigated by immunoblotting, MTT assay, TUNEL assay, and soft agar assay.||||PIN1 expression is up-regulated in A375R cells, a PLX4032-resistant subline of melanoma cells generated from an A375 cell line, compared to parental A375 cells. Indeed, PIN1 positively regulated the expression of EGFR in A375R cells and led to activation of the RAF/MEK/ERK pathway. Importantly, PLX4032, when used in combination with ATRA, an inhibitor of PIN1, reduced EGFR expression, and consequently reduced cell viability and anchorage-independent growth of A375R cells compared to PLX4032 alone. Furthermore, co-treatment with ATRA and PLX4032 increased cleaved PARP and DNA fragmentation in A375R cells.||||PIN1 plays an important role in the development of PLX4032 resistance through up-regulation of EGFR expression.
dffc59def0833894b869a2d915e7cb56e6c08a928b838f3e76ecac69a5a49a2e	_PROTEIN_ is upregulated in many _DISEASE_.	PMID:31669266	ADRM1	PR:000003793	[[0..5]]	cancers	MONDO:0004992	[[29..36]]	null	37	Y	ADRM1 is upregulated in many cancers.	Prognostic and Therapeutic Significance of Adhesion-regulating Molecule 1 in Estrogen Receptor-positive Breast Cancer.||||||||Adhesion-regulating molecule 1 (ADRM1) is a polyubiquitin receptor on the 26S proteasome. ADRM1 is upregulated in many cancers. In this study, we evaluated the potential prognostic and predictive value of ADRM1 in breast cancer.||||Individual and pooled survival analyses were performed on 19 independent breast cancer microarray datasets. Gene signatures enriched by ADRM1 were also analyzed in pooled datasets.||||) breast cancer cases than in ER-negative breast cancer cases. In cases involving stage II breast cancer, radiotherapy significantly reduced the relative risk of OS in the ADRM1-low subgroup.|||| breast cancer.
2940f3ec03681d2d4414d06094c113c932d0ceb38fcebff7110254f8c4848b09	The emerging roles of _PROTEIN_ in _DISEASE_.	PMID:31812670	KPNA2	PR:000009433	[[22..27]]	cancer	MONDO:0004992	[[31..37]]	null	38	Y	The emerging roles of KPNA2 in cancer.	The emerging roles of KPNA2 in cancer.||||||||Karyopherin α2 (KPNA2, also known as importinα-1), a member of the nuclear transporter family, is involved in the nucleocytoplasmic transport pathway of a variety of tumor-associated proteins. Recent studies have found that KPNA2 is overexpressed in various cancers, which is associated with poor prognosis. In addition, it has been shown to promote tumor formation and progression by participating in cell differentiation, proliferation, apoptosis, immune response, and viral infection. It is indicated that KPNA2 also plays an important role in the diagnosis, treatment and prognosis of tumors. Herein, we provide an overview of the function and mechanism of KPNA2 in cancer and the prospects in the diagnosis and treatment of cancer. In the future, KPNA2 provides new ideas for the early diagnosis of malignant tumors, the development of molecularly targeted drugs, and prognosis evaluation.
6b47d32f1c70da20f831a17938c563869ce5ae769a77935da5055d6c021e921b	The expression of _PROTEIN_ is high in _DISEASE_.	PMID:31204946	Gli1	PR:000008026	[[18..22]]	MDS	MONDO:0009532	[[34..37]]	null	38	Y	The expression of Gli1 is high in MDS.	[Expression Level and Clinical Significance of Gli1 in Patients with Myelodysplastic Syndrome].||||||||To study the expression level and clinical significance of Gli1 gene in patients with myelodysplastic syndrome(MDS).|||| cells was detected by RT-qPCR, 25 patients with iron deficiency anemia were selected as controls. The relationship of Gli1 expression with clinical characteristics were analyzed.||||The expression of Gli1 in patients with MDS (0.73±1.26) was significantly higher than that in the control group (0.07±0.46) (P＜0.05). The expression of Gli1 significantly correlated with platelet count, chromosome grouping and IPSS risk stratification (P＜0.05). The median overall survival time of patients in high and low expression groups were 7 and 20 months respectively (P＜0.05). Multivariate analysis showed that Gli1 and chromosome grouping were 2 independent poor prognostic factors (P＜0.05).||||The expression of Gli1 is high in MDS. Abnormal expression of Gli1 positively correlates with clinical characteristics and prognosis of patients.Gli1 may be involved in the occurrence and development of MDS.
