e01f34c95a9b43de5fc188e005f65519ccb11624e4a907085b18ae29cce7a5ff	No _DISEASE_ was _PROTEIN_/neu positive.	PMID:31517642	HER2	PR:P34708	[[17..21]]	carcinoma	MONDO:0004993	[[3..12]]	null	35	N	No carcinoma was HER2/neu positive.	Biomarkers of Targeted Therapy and Immuno-Oncology in Cancers Metastatic to the Breast.||||||||The breast is a rare site for metastases, and their molecular characteristics have not been studied yet. Intrinsic molecular genetics, cancer characteristics, and breast tissue immune responses in diverse metastases to the breast have not been previously studied. We identified 64 patients with cancers metastatic to the breast: 51 carcinomas and 13 melanomas. Programmed death ligand 1 (PD-L1), steroid receptors, and HER2/neu expressions were evaluated using immunohistochemistry. Gene sequencing, copy number alterations, microsatellite instability, and tumor mutational burden were performed using next-generation sequencing platforms. The 3 most common primary sites for metastatic carcinomas were lung (37%), ovary (29%), and fallopian tubes/peritoneum (14%). TP53 mutations were commonly (50%) observed among the carcinoma cases, while other mutations were characteristic for the primary cancers (VHL in renal, BRCA1 in the fallopian tube, and BRAF in melanomas). High tumor mutational burden was detected in 5/14 carcinomas and 3/7 melanomas. Tumor cell PD-L1 expression was detected in 6 carcinomas, but not in any of the melanomas, whereas immune cells' expression of PD-L1 was seen in 17 carcinomas and 6 melanomas. Estrogen receptor status was positive in 13/49 carcinomas including 12 adenocarcinomas originating from the ovary and fallopian tube or peritoneum and 1 duodenal neuroendocrine carcinoma. No carcinoma was HER2/neu positive. Intrinsic genetic characteristics of the metastases to the breast followed the pattern commonly seen in primary tumors. Biomarkers of potential benefit to immune checkpoint inhibition therapy were limited to PD-L1-positive non-small cell lung cancer. No common characteristics of the heterogeneous group of tumor metastases to this organ were identified.
54ff99d0b9b1bf9fec232620684371f6dc0e8171a172e6f3ad22708346a45c08	46 XX, _PROTEIN_ Negative _DISEASE_.	PMID:31315334	SRY	PR:000015643	[[7..10]]	Ovotesticular DSD	MONDO:0016281	[[20..37]]	null	38	N	46 XX, SRY Negative Ovotesticular DSD.	46 XX, SRY Negative Ovotesticular DSD.||||||||46 XX ovotesticular DSD is a rare disorder. It presents with cryptorchidism, hypospadias or ambiguous genitalia at birth, gynaecomastia in adolescent stage or infertility in adult age. We report here a 20 year old phenotypically male who presented with gynaecomastia and found to have testis on right side and left inguinoscrotal swelling consisting of ovary, uterus and fallopian tubes. Evaluation revealed SRY negative 46 XX karyotype. He underwent surgical removal of ovary and mullerian structures. The highlight of case is development of testicular tissue in absence of SRY gene.
c1b7c9a6d436a51e3c9df11b723f8c8859e23398ab2dfb7a8826277d285d5694	All _DISEASE_ were CK5/6 and _PROTEIN_ positive.	PMID:31548087	p40	PR:O23474	[[26..29]]	tumors	MONDO:0005070	[[4..10]]	null	39	N	All tumors were CK5/6 and p40 positive.	Rare variants of head and neck squamous cell carcinoma -differential immunohistochemical profiles.||||||||We aimed to immunohistochemically characterize the pattern of expression of epithelial markers in rare head and neck squamous cell carcinoma (HNSCC) variants: carcinoma cuniculatum (CC) and adenosquamous carcinoma (ASC). We also present an additional variant of HNSCC with concomitant basaloid and squamous components that has overlapping morphological features with odontogenic and non-odontogenic tumors, which we termed basalo-squamous carcinoma (BSC). The selected markers included CK5/6, p40, CK19, BerEP4, p16 and SOX10. All tumors were CK5/6 and p40 positive. CK19 and BerEP4 were positive in BSC and focally in ASC but negative in CC. p16 was positive in 3 (60%) of the CCs, focally positive in ASC and negative in BSC. SOX10 was negative in all three variants. Our results highlight the plasticity of the lining epithelium revealing differential profiles of immuno-expression of the selected molecular markers, possibly reflecting their diverse histopathogenesis.
37a573ba9d54d1a7ee286bb95970dc24d88de17de3bb07746a3863b24fc71f97	_PROTEIN_ was expressed in 24.6% of the _DISEASE_.	PMID:31054899	IMP3	PR:000009020	[[0..4]]	tumors	MONDO:0005070	[[35..41]]	null	42	N	IMP3 was expressed in 24.6% of the tumors.	Addition of IMP3 to L1CAM for discrimination between low- and high-grade endometrial carcinomas: a European Network for Individualised Treatment of Endometrial Cancer collaboration study.||||||||Discrimination between low- and high-grade endometrial carcinomas (ECs) is clinically relevant but can be challenging for pathologists, with moderate interobserver agreement. Insulin-like growth factor-II mRNA-binding protein 3 (IMP3) is an oncofoetal protein that is associated with nonendometrioid endometrial carcinomas but has been limited studied in endometrioid carcinomas. The aim of this study is to investigate the diagnostic and prognostic value of IMP3 in the discrimination between low- and high-grade ECs and its added value to L1CAM. IMP3 and L1CAM expression was assessed in tumors from 378 patients treated for EC at 1 of 9 participating European Network for Individualised Treatment of Endometrial Cancer centers. IMP3 was expressed in 24.6% of the tumors. In general, IMP3 was more homogeneously expressed than L1CAM. IMP3 expression was significantly associated with advanced stage, nonendometrioid histology, grade 3 tumors, deep myometrial invasion, lymphovascular space invasion, distant recurrences, overall mortality, and disease-related mortality. Simultaneous absence of IMP3 and L1CAM expression showed the highest accuracy for identifying low-grade carcinomas (area under the curve 0.766), whereas simultaneous expression of IMP3 and L1CAM was strongly associated with high-grade carcinomas (odds ratio 19.7; 95% confidence interval 9.2-42.2). Even within endometrioid carcinomas, this combination remained superior to IMP3 and L1CAM alone (odds ratio 8.6; 95% confidence interval 3.4-21.9). In conclusion, IMP3 has good diagnostic value and together with L1CAM represents the optimal combination of diagnostic markers for discrimination between low- and high-grade ECs compared to IMP3 and L1CAM alone. Because of the homogenous expression of IMP3, this marker might be valuable in preoperative biopsies when compared to the more patchy L1CAM expression.
755f0e2c6307ffc4a9add4bcc40bb2e301604aff23f49a99687e8029663317b6	_PROTEIN_ mutations were analysed in 290 _DISEASE_ cases.	PMID:31498468	TBK1	PR:000001779	[[0..4]]	ALS	MONDO:0004976	[[36..39]]	null	46	N	TBK1 mutations were analysed in 290 ALS cases.	Neuropathological characterization of a novel TANK binding kinase (TBK1) gene loss of function mutation associated with amyotrophic lateral sclerosis.||||||||Mutations in TANK binding kinase gene (TBK1) are causative in amyotrophic lateral sclerosis (ALS), however correlations between clinical features and TBK1 mutations have not been fully elucidated. We aimed to identify and compare TBK1 mutations to clinical features in a cohort of ALS patients from Northern England.||||TBK1 mutations were analysed in 290 ALS cases. Immunohistochemistry was performed in brain and spinal cord of one case with a novel in-frame deletion.||||Seven TBK1 variants were identified, including one novel in-frame deletion (p.85delIle). In silico analysis and literature suggested four variants were pathogenic, and three were variants of uncertain significance or benign. Post-mortem immunohistochemistry established an individual with the novel in-frame deletion had classical ALS and Type B FTLD-TDP pathology, with no changes in TBK1 staining or interferon regulatory factor IRF3.||||TBK1 mutations were present in 1.38% of our cohort, and screening showed no clear genotype-phenotype associations compared to other genetic and sporadic ALS cases. TBK1 immunohistochemistry was consistent with previously published literature and we are the first to show no differential expression of interferon regulatory factor IRF3, a downstream effector of TBK1 in the immune pathway, in the TBK1-mutant tissue, compared to controls.
1d758ff981f4a3e182346840d81bbbe7ffe0e10e34100f1c56af2d5eeb63af38	The trinity of _PROTEIN_, _DISEASE_, and time.	PMID:31201004	tau	PR:000024142	[[15..18]]	trauma	MONDO:0021178	[[20..26]]	null	37	N	The trinity of tau, trauma, and time.	The trinity of tau, trauma, and time.
902a6674ecc20434ccf38cd17c0495fc78a58cf0241b996a3e9489d98069c564	_DISEASE_ (_PROTEIN_) mutation.	PMID:31384696	APC	PR:000004122	[[28..31]]	Adenomatous Polyposis Coli	MONDO:0021055	[[0..26]]	null	42	N	Adenomatous Polyposis Coli (APC) mutation.	The link between colon cancer and congenital hypertrophy of the retinal pigment epithelium (CHRPE).||||||||Clarify the differences between Familial Adenomatous Polyposis (FAP)-associated Congenital Hypertrophy of the Retinal Epithelium (CHRPE) and benign variants with regards to lesion characteristics and associated risk.|||| Adenomatous Polyposis Coli (APC) mutation.|||| Familial Adenomatous Polyposis.
1a8599ec52d746bbe2789ee332e9a1cc043ed5a057071880d34bbebb518bd6cb	Prospects of CRISPR/_PROTEIN_9 for _DISEASE_ Elimination	PMID:31332399	Cas	PR:000005929	[[20..23]]	HIV	MONDO:0005798	[[29..32]]	null	44	N	Prospects of CRISPR/Cas9 for HIV Elimination	Prospects of CRISPR/Cas9 for HIV Elimination
8bcc8513890a09fb36b3ba8acb7fb5bc2e3461972f840f01b875b786b8cb2c43	_PROTEIN_: a potential _DISEASE_ drug target.	PMID:31159623	ASCT2	PR:000014976	[[0..5]]	cancer	MONDO:0004992	[[19..25]]	null	38	N	ASCT2: a potential cancer drug target.	ASCT2: a potential cancer drug target.
0c36341e047e47a3a0e6566b89184d5ed03b59c881e2b50e2e221e4cb6c52fb2	T-cells in _DISEASE_ tissues compared with _PROTEIN_.	PMID:31220695	Ta1	PR:000015201	[[39..42]]	tumor	MONDO:0005070	[[11..16]]	null	43	N	T-cells in tumor tissues compared with Ta1.	Fusion of thymosin alpha 1 with mutant IgG1 CH3 prolongs half-life and enhances antitumor effects in vivo.|||||||| T-cells in tumor tissues compared with Ta1. Tα1-mCH3 exhibited better effect in promoting the production of IL-2 and IFN-γ compared with Tα1. Therefore, Tα1-mCH3 more efficiently inhibited the growth of 4 T1 and B16F10 tumors than Tα1. In conclusion, fusion with mCH3 is an attractive strategy to lengthen the half-life and increase the activity of Tα1.
1ef70cacee62f199291119965e13f9c951a29dc4bd47ab93e6b6aa8de75ccfcd	The Roles of _PROTEIN_? in _DISEASE_.	PMID:31632911	TIF1	PR:P78954	[[13..17]]	Cancer	MONDO:0004992	[[22..28]]	null	29	Y	The Roles of TIF1? in Cancer.	The Roles of TIF1γ in Cancer.||||||||Transcriptional intermediary factor 1 γ (TIF1γ), also known as TRIM33, RFG7, PTC7, or Ectodermin, is an E3 ubiquitin-ligase family member with a ring-box-coiled-coil region. It can regulate TGF-β/Smad signaling in two different ways in different cellular contexts. On one hand, TIF1γ can monoubiquitinate Smad4 to inhibit the formation of Smad2/3/4 nuclear complexes. On the other hand, TIF1γ can function as a cofactor of phosphorylated (p)-Smad2/3, competing with Smad4 to inhibit the formation of the Smad2/3/4 complex. In addition, TIF1γ has been reported to play a role in transcription elongation, cellular differentiation, embryonic development, and mitosis. As transforming growth factor-β (TGF-β) superfamily signaling plays an important role in the occurrence and development of cancer, and TIF1γ was reported to be involved in the regulation of TGF-β superfamily signaling, studies on TIF1γ during the last decade have focused on its role in the development of cancer. However, TIF1γ can function either as a tumor suppressor or promoter in different cellular contexts, yet there are few reviews focusing on the roles of TIF1γ in cancer. Hence, in this paper we systematically review and discuss the roles of TIF1γ in cancer. Firstly, we review the biological features, the regulatory mechanisms and the related signaling pathways of TIF1γ. Next, we illustrate the roles of TIF1γ in different tumors. We then provide a tentative hypothesis that explains the dual roles of TIF1 γ in cancer. Finally, we provide our viewpoint regarding the future developments of cancer research focusing on TIF1γ, especially in relation to the effects of TIF1γ on tumoral immunity.
32776241a69c1d2301815440cd9534e9e39dac5485fb369a981053efc3f52cb8	Roles of _PROTEIN_ in _DISEASE_.	PMID:31037633	Periostin	PR:000013031	[[9..18]]	Asthma	MONDO:0004979	[[22..28]]	null	29	Y	Roles of Periostin in Asthma.	Roles of Periostin in Asthma.||||||||Periostin is a matricellular protein that is deeply involved in type-2/eosinophilic airway inflammation and remodeling in asthma. While its expression in airway epithelial cells is correlated with the thickness of airway basement membrane, more importantly, periostin can be detected stably in blood with little variability, reflecting airway type-2 inflammation and remodeling. As for a result, serum periostin can serve as a valuable marker to identify patients with type-2 severe asthma who are insensitive to inhaled corticosteroids, and consequently have the excess decline of pulmonary function with asthma exacerbations. Serum periostin may significantly help to improve management of patients with severe asthma.
e927877b7598319af4761ee1e91d84026624685d5d5218808515a15173a5cefb	_PROTEIN_ and _DISEASE_, which links?	PMID:31206681	SPTBN1	PR:000003166	[[0..6]]	cancer	MONDO:0004992	[[11..17]]	null	31	Y	SPTBN1 and cancer, which links?	SPTBN1 and cancer, which links?||||||||SPTBN1 is a dynamic intracellular nonpleckstrin homology-domain protein, functioning as a transforming growth factor-β signal transducing adapter protein which is necessary to form Smad3/Smad4 complex. Recently SPTBN1 is considered to be associated with many kinds of cancers. SPTBN1 expression and function differ between different tumor states or types. This review summarizes the recent advances in the expression patterns of SPTBN1 in cancers, and in understanding the mechanisms by which SPTBN1 affects the occurrence, progression, and metastasis of cancer. Identifying SPTBN1 expression and function in cancers will contribute to the clinical diagnosis and treatment of cancer and the investigation of anticancer drugs.
1bacfa4a867f828de4dbd7eee6f98901db16f5fdad9577c0fce41eff9e3826a9	_PROTEIN_ in _DISEASE_: Mediator and more.	PMID:31173856	Akt	PR:P54644	[[0..3]]	cancer	MONDO:0004992	[[7..13]]	null	33	Y	Akt in cancer: Mediator and more.	Akt in cancer: Mediator and more.||||||||Akt is a serine/threonine kinase and it participates in the key role of the PI3K signaling pathway. The Akt can be activated by a wide range of growth signals and the biochemical mechanisms leading to Akt activation are well defined. Once activated, Akt modulates the function of many downstream proteins involved in cellular survival, proliferation, migration, metabolism, and angiogenesis. The Akt is a central node of many signaling pathways and it is frequently deregulated in many types of human cancers. In this review, we provide an overview of Akt function and its role in the hallmarks of human cancer. We also discussed various mechanisms of Akt dysregulation in cancers, including epigenetic modifications like methylation, post-transcriptional non-coding RNAs-mediated regulation, and the overexpression and mutation.
38ad0f0ec28aeb039f08448202eea2220c1ed76d7ee4300c96b5a553dd3b7e40	_PROTEIN_: not just a _DISEASE_ suppressor.	PMID:31291648	p53	PR:Q42578	[[0..3]]	tumor	MONDO:0005070	[[16..21]]	null	33	Y	p53: not just a tumor suppressor.	p53: not just a tumor suppressor.
538b37addc145dc554aa5a4709971f34eeedf285c9ba39a12118ce0c4d0cddda	Seven _DISEASE_ showed loss of MLH1/_PROTEIN_.	PMID:31567138	PMS2	PR:000012914	[[33..37]]	tumors	MONDO:0005070	[[6..12]]	null	38	Y	Seven tumors showed loss of MLH1/PMS2.	Mismatch Repair Deficiency in Endometrial Cancer: Immunohistochemistry Staining and Clinical Implications.||||||||DNA mismatch repair (MMR) deficiency is associated with increased risk of developing several types of cancer and is the most common cause of hereditary endometrial cancer. Identification of the microsatellite instability (MSI) phenotype in endometrial carcinoma is important given that such tumors are frequent.||||The objective of this study was to assess the utility of immunohistochemistry (IHC), a simple and fast technique, in detecting MSI status in endometrial carcinoma and evaluate the correlation between the MSI phenotype and the various anatomo-clinical parameters.||||IHC expression of 4 markers (MLH1, MSH2, PMS2, and MSH6) was studied. For all IHC markers, a combined score based on the intensity of nuclear labeling and the percentage of labeled cells was defined to establish a score. Correlation between MSI phenotype and different clinicopathologic parameters was evaluated using statistical analysis (software STATA and the Fisher exact test).||||The mean age of the patients was 58.6 years. Positive staining was highly extended (score 3) with 79% to 100% of marked cells. Less than 10% of positive tumor cells were seen in 3% of cases for MSH6 and PMS2. Abnormal MMR IHC was detected in 10 cases (22.22%). Seven tumors showed loss of MLH1/PMS2. The loss of MSH2/MSH6 was observed in 1 case. The loss of MLH1 or PMS2 was seen only in 2 cases. The number of MSI positive status was 10 cases (22.7%). Correlation between clinicopathologic parameters showed MMR deficiency was significantly associated with low-grade tumor and localized stage. There was no positive correlation between age, histologic subtype, or myometrium invasion.||||In summary, detection of DNA MMR deficiencies by IHC can effectively diagnose the MSI phenotype in endometrial carcinoma. Correlation between clinicopathologic parameters showed MMR deficiency was significantly associated with low-grade tumor and localized stage.
2ed70af4f7e99e8b162fd6f0e614e1fd093ad69bc22ab8696e7c68db9bc66be1	Therapy of _PROTEIN_ _DISEASE_.	PMID:31319911	Transthyretin	PR:000016801	[[11..24]]	Cardiomyopathy	MONDO:0004994	[[25..39]]	null	40	Y	Therapy of Transthyretin Cardiomyopathy.	Therapy of Transthyretin Cardiomyopathy.
4b83c564f1a75a65a2fe759de9fd0f5e834ebded787a06c24afe39080c953e3f	_PROTEIN_ Genotype in _DISEASE_.	PMID:31324923	Interleukin-1	PR:000001091	[[0..13]]	Periodontitis	MONDO:0005076	[[26..39]]	null	40	Y	Interleukin-1 Genotype in Periodontitis.	Interleukin-1 Genotype in Periodontitis.||||||||This paper presents the current knowledge concerning the role of polymorphisms of IL1A and IL1B genes in periodontitis. Attention has been paid to the role of IL-1 in the pathogenesis of the disease, and to the significance of a genetic test, investigating the presence of composite two polymorphisms of IL-1 gene, as a risk factor for severe periodontitis. The significance of this test for prevention of periodontitis and its therapy has been discussed. IL-1 polymorphisms have been presented and described according to the reference single nucleotide polymorphism (SNP) identification number (rsID), established to eradicate the redundancy of reported polymorphisms in the SNP database processed by the National Center for Biotechnology Information. The prevalence of these genotypes in different populations and ethnic groups and its effect on periodontal health have been discussed. The presented data show inconsistent results. It seems that at least two polymorphisms, rs1800587 and rs1143634, are associated with periodontal inflammation. Therefore, they can be regarded as candidate genes involved in further periodontitis risk assessment. It seems that geographical and ethnical factors can play a great role, as the prevalence of specific polymorphisms varies greatly depending on the population studied.
05e3dc287661a6a4363659d734088f23d867ba83ff86d73341d478c90d52cede	The role of _PROTEIN_ in canine _DISEASE_ is unclear.	PMID:31696573	VEGF	PR:000003096	[[12..16]]	AD	MONDO:0004975	[[27..29]]	null	41	Y	The role of VEGF in canine AD is unclear.	Noninvasive evaluation of vascular endothelial growth factor-A (VEGF-A) protein concentrations in the stratum corneum and serum of healthy and atopic dogs.||||||||Vascular endothelial growth factor (VEGF) is a cytokine involved primarily in angiogenesis. In human atopic dermatitis (AD), VEGF has been detected in the stratum corneum and blood.||||To evaluate VEGF-A expression in the serum and stratum corneum of healthy and atopic dogs, and its possible correlation with disease severity in atopic dogs.||||Fifteen atopic and 15 healthy, privately owned dogs.||||The severity of clinical signs associated with AD was evaluated with the Canine Atopic Dermatitis Extent and Severity Index (CADESI-04). For all dogs, a single blood sample was performed and serum collected. Tape stripping (15 times) was performed on the left periocular area (lesional skin). A commercially available canine-specific VEGF-A enzyme-linked immunosorbent assay was performed with all samples.||||Vascular endothelial growth factor-A was undetectable in the serum. In the stratum corneum, there was no significant difference in VEGF-A concentrations between healthy (mean 89.4 ± 59.5 pg/ml) and atopic dogs (mean 100.3 ± 77.1pg/ml) (P = 0.71). There was no correlation between stratum corneum VEGF-A concentrations and CADESI-04 scores.||||The role of VEGF in canine AD is unclear. Because of many variants, VEGF-C and VEGF-D or VEGF-A isotopes should be explored in the skin to better evaluate the role of VEGF in canine atopy. Full-thickness skin biopsy, molecular biology and histopathological investigation may be necessary to further assess cutaneous VEGF expression.
b12ba6652efcfd2567703125b21047e43583aa8f6757150bcd58b53a811f1c63	_PROTEIN_-POL ? Inhibition and _DISEASE_ Therapy.	PMID:31398321	REV1	PR:000013899	[[0..4]]	Cancer	MONDO:0004992	[[26..32]]	null	41	Y	REV1-POL ? Inhibition and Cancer Therapy.	REV1-POL ζ Inhibition and Cancer Therapy.||||||||In a recent issue of Cell, Wojtaszek et al. (2019) reported a small-molecule inhibitor of mutagenic translesion DNA synthesis, which targets the interaction between REV1 and REV7, sensitizes cancer cells to cisplatin in vitro and in vivo, and reduces mutagenesis.
087072e13235276bb488fb4a4742cabd524fc5208c7fc8446328f831f33ce7d4	_PROTEIN_ as a therapeutic target for _DISEASE_.	PMID:31360238	TIMP-3	PR:000016354	[[0..6]]	cancer	MONDO:0004992	[[35..41]]	null	42	Y	TIMP-3 as a therapeutic target for cancer.	TIMP-3 as a therapeutic target for cancer.||||||||Tissue inhibitor of metalloproteinase-3 (TIMP-3), a secreted glycoprotein, plays an important role in carcinogenesis. It can bind to many proteinases to suppress their activity and thus protect the extracellular matrix from degradation. TIMP-3 may have many anticancer properties, including apoptosis induction and antiproliferative, antiangiogenic, and antimetastatic activities. This review summarizes the structure, proteinase inhibition ability, genetic and epigenetic regulation, cancer therapy potential, and contribution to cancer development of TIMP-3. Furthermore, in this review we discuss its potential as a biomarker for predicting cancer progression and the current state of drugs that target TIMP-3, either alone or in combination with clinical treatment. In conclusion, TIMP-3 can be a biomarker of cancer and a potential target for cancer therapy. This review article can serve as a basis to understand how to modulate TIMP-3 levels as a drug target of cancers.
